{
  "$schema": "https://json-schema.org/draft/2020-12/schema",
  "$id": "https://raw.githubusercontent.com/julian-passebecq/datapass-mosaicstudio/main/spec/bundle/v1/bundle.schema.json",
  "title": "datapass.bundle v1 (candidate)",
  "description": "One JSON document carrying a provenance file set as exact strings. sha256 is the SHA-256 of the exact UTF-8 text; SHA256SUMS lists every other file as \"<sha256>  <path>\" sorted by path, and its own SHA-256 identifies the bundle. Members runs.json, inputs.json and lineage.json follow $defs. Not a signature, release or verified lineage; never carries tokens.",
  "type": "object",
  "additionalProperties": false,
  "required": [
    "format",
    "version",
    "status",
    "title",
    "createdAt",
    "notice",
    "files"
  ],
  "properties": {
    "format": {
      "const": "datapass.bundle"
    },
    "version": {
      "const": 1
    },
    "status": {
      "const": "candidate"
    },
    "title": {
      "type": "string",
      "minLength": 1,
      "maxLength": 160
    },
    "createdAt": {
      "type": "string",
      "pattern": "^[1-9]\\d{3}-\\d{2}-\\d{2}T\\d{2}:\\d{2}:\\d{2}\\.\\d{3}Z$"
    },
    "notice": {
      "type": "string",
      "minLength": 1,
      "maxLength": 2000
    },
    "files": {
      "type": "array",
      "minItems": 2,
      "maxItems": 64,
      "items": {
        "type": "object",
        "additionalProperties": false,
        "required": [
          "path",
          "mediaType",
          "bytes",
          "sha256",
          "text"
        ],
        "properties": {
          "path": {
            "type": "string",
            "pattern": "^(SHA256SUMS|runs\\.json|inputs\\.json|lineage\\.json|artifacts\\/[a-z][a-zA-Z0-9_-]{0,79}\\.json)$"
          },
          "mediaType": {
            "enum": [
              "application/json",
              "text/plain; charset=utf-8"
            ]
          },
          "bytes": {
            "type": "integer",
            "minimum": 0,
            "maximum": 2097152
          },
          "sha256": {
            "type": "string",
            "pattern": "^[0-9a-f]{64}$"
          },
          "text": {
            "type": "string"
          }
        }
      }
    }
  },
  "$defs": {
    "runs": {
      "type": "object",
      "additionalProperties": false,
      "required": [
        "format",
        "version",
        "runs"
      ],
      "properties": {
        "format": {
          "const": "datapass.bundle-runs"
        },
        "version": {
          "const": 1
        },
        "runs": {
          "type": "array",
          "maxItems": 200,
          "items": {
            "type": "object",
            "additionalProperties": false,
            "required": [
              "runId",
              "taskId",
              "appId",
              "appVersion",
              "model",
              "outcome",
              "startedAt",
              "finishedAt",
              "artifact",
              "resultSha256"
            ],
            "properties": {
              "runId": {
                "type": "string",
                "pattern": "^[A-Za-z0-9][A-Za-z0-9._:-]{0,159}$"
              },
              "taskId": {
                "type": "string",
                "pattern": "^[a-z][a-zA-Z0-9_-]{0,79}$"
              },
              "appId": {
                "type": "string",
                "pattern": "^[a-z][a-zA-Z0-9_-]{0,79}$"
              },
              "appVersion": {
                "type": "string",
                "minLength": 1,
                "maxLength": 80
              },
              "model": {
                "type": "object",
                "additionalProperties": false,
                "required": [
                  "id",
                  "version",
                  "provider"
                ],
                "properties": {
                  "id": {
                    "type": "string",
                    "pattern": "^[a-z][a-zA-Z0-9_-]{0,79}$"
                  },
                  "version": {
                    "type": "string",
                    "minLength": 1,
                    "maxLength": 80
                  },
                  "provider": {
                    "type": "string",
                    "pattern": "^[a-z][a-zA-Z0-9_-]{0,79}$"
                  }
                }
              },
              "outcome": {
                "enum": [
                  "succeeded",
                  "failed",
                  "cancelled",
                  "superseded",
                  "timed-out",
                  "unobserved"
                ]
              },
              "startedAt": {
                "anyOf": [
                  {
                    "type": "string",
                    "pattern": "^[1-9]\\d{3}-\\d{2}-\\d{2}T\\d{2}:\\d{2}:\\d{2}\\.\\d{3}Z$"
                  },
                  {
                    "type": "null"
                  }
                ]
              },
              "finishedAt": {
                "anyOf": [
                  {
                    "type": "string",
                    "pattern": "^[1-9]\\d{3}-\\d{2}-\\d{2}T\\d{2}:\\d{2}:\\d{2}\\.\\d{3}Z$"
                  },
                  {
                    "type": "null"
                  }
                ]
              },
              "artifact": {
                "anyOf": [
                  {
                    "type": "object",
                    "additionalProperties": false,
                    "required": [
                      "id",
                      "path",
                      "sha256"
                    ],
                    "properties": {
                      "id": {
                        "type": "string",
                        "pattern": "^[a-z][a-zA-Z0-9_-]{0,79}$"
                      },
                      "path": {
                        "type": "string"
                      },
                      "sha256": {
                        "type": "string",
                        "pattern": "^[0-9a-f]{64}$"
                      }
                    }
                  },
                  {
                    "type": "null"
                  }
                ]
              },
              "resultSha256": {
                "anyOf": [
                  {
                    "type": "string",
                    "pattern": "^[0-9a-f]{64}$"
                  },
                  {
                    "type": "null"
                  }
                ]
              }
            }
          }
        }
      }
    },
    "inputs": {
      "type": "object",
      "additionalProperties": false,
      "required": [
        "format",
        "version",
        "note",
        "runs"
      ],
      "properties": {
        "format": {
          "const": "datapass.bundle-inputs"
        },
        "version": {
          "const": 1
        },
        "note": {
          "type": "string",
          "minLength": 1
        },
        "runs": {
          "type": "array",
          "maxItems": 200,
          "items": {
            "type": "object",
            "additionalProperties": false,
            "required": [
              "runId",
              "values"
            ],
            "properties": {
              "runId": {
                "type": "string",
                "pattern": "^[A-Za-z0-9][A-Za-z0-9._:-]{0,159}$"
              },
              "values": {
                "type": "object",
                "maxProperties": 100,
                "propertyNames": {
                  "pattern": "^[A-Za-z_][A-Za-z0-9_-]{0,79}$"
                },
                "additionalProperties": {
                  "anyOf": [
                    {
                      "type": "null"
                    },
                    {
                      "type": "boolean"
                    },
                    {
                      "type": "number"
                    },
                    {
                      "type": "string",
                      "maxLength": 4000
                    }
                  ]
                }
              }
            }
          }
        }
      }
    },
    "lineage": {
      "type": "object",
      "additionalProperties": false,
      "required": [
        "format",
        "version",
        "note",
        "artifacts"
      ],
      "properties": {
        "format": {
          "const": "datapass.bundle-lineage"
        },
        "version": {
          "const": 1
        },
        "note": {
          "type": "string",
          "minLength": 1
        },
        "artifacts": {
          "type": "array",
          "items": {
            "type": "object",
            "additionalProperties": false,
            "required": [
              "id",
              "path",
              "sha256",
              "kind",
              "source",
              "runId",
              "inputHash",
              "dependsOn"
            ],
            "properties": {
              "id": {
                "type": "string",
                "pattern": "^[a-z][a-zA-Z0-9_-]{0,79}$"
              },
              "path": {
                "type": "string"
              },
              "sha256": {
                "type": "string",
                "pattern": "^[0-9a-f]{64}$"
              },
              "kind": {
                "enum": [
                  "synthetic",
                  "provided",
                  "computed"
                ]
              },
              "source": {
                "type": "string"
              },
              "runId": {
                "anyOf": [
                  {
                    "type": "string"
                  },
                  {
                    "type": "null"
                  }
                ]
              },
              "inputHash": {
                "anyOf": [
                  {
                    "type": "string"
                  },
                  {
                    "type": "null"
                  }
                ]
              },
              "dependsOn": {
                "type": "array",
                "items": {
                  "type": "string"
                }
              }
            }
          }
        }
      }
    }
  }
}
